{
  "id": "D-4",
  "wo": "WO-2001",
  "kind": "resume",
  "ask": "Resume the paused demo runner?",
  "options": [
    "Yes",
    "Hold",
    "No"
  ],
  "recommended": "Yes",
  "why": "The tests and the review are green.",
  "answer": null,
  "note": null,
  "at": "2030-01-07T10:00:00Z",
  "answeredAt": null,
  "via": null
}
